{
  "bulk_validation": {
    "archive_chrome_contamination_count": 0,
    "archive_snapshot_time_coverage_count": 74,
    "blog_2024_articles": 18,
    "category_distribution": {
      "Campaigns": 19,
      "Company News": 22,
      "Education": 12,
      "New Features": 12,
      "Partnerships": 2,
      "Product": 5,
      "Trends": 1,
      "unknown": 1
    },
    "cn_chat_overlap_articles": 10,
    "content_hash_duplicates": 0,
    "current_live_articles": 3,
    "failed_snapshots": 0,
    "failure_reason_counts": {},
    "html_language_distribution": {
      "en": 66,
      "ru": 8
    },
    "language_distribution": {
      "en": 74
    },
    "language_mismatch_count": 8,
    "normalized_content_max_chars": 45064,
    "normalized_content_min_chars": 822,
    "official_index_linked_archive_articles": 74,
    "original_canonical_url_coverage_count": 77,
    "parser_failure_count": 0,
    "provenance_incomplete_cases": 0,
    "publication_date_coverage_count": 77,
    "selected_archive_articles": 74,
    "successfully_acquired_archive_snapshots": 74,
    "total_blog_catalog_articles": 77
  },
  "catalog": {
    "article_2024_count": 18,
    "cn_chat_overlap_article_count": 10,
    "current_live_article_count": 3,
    "observed_at": "2026-09-10T19:01:40.556129Z",
    "official_index_linked_archive_article_count": 74,
    "publication_date_coverage_count": 77,
    "raw_hash": "380d82dd137b17c5527a76115dbff61d31249900280c1c082667ca9e08928892",
    "total_article_count": 77,
    "url": "https://blum.io/blog"
  },
  "cn_chat_coverage": {
    "article_count": 10,
    "coverage_assessment": "10 dated official-catalog events; useful event coverage but not proof the 2025-2026 snapshots were unchanged since 2024 publication",
    "events": [
      {
        "archive_snapshot_at": "2026-01-16T19:06:20Z",
        "official_catalog_category": "Trends",
        "official_catalog_publication_date": "2024-03-29",
        "official_catalog_title": "Crypto with Blum: Why It's a Gen Z and Millennial Must",
        "original_canonical_url": "https://blum.io/post/crypto-with-blum-why-its-a-gen-z-and-millennial-must"
      },
      {
        "archive_snapshot_at": "2026-05-13T19:10:42Z",
        "official_catalog_category": "Company News",
        "official_catalog_publication_date": "2024-04-09",
        "official_catalog_title": "Blum: Your Go-To Crypto App",
        "original_canonical_url": "https://blum.io/post/blum-your-go-to-crypto-app"
      },
      {
        "archive_snapshot_at": "2026-05-13T18:55:54Z",
        "official_catalog_category": "New Features",
        "official_catalog_publication_date": "2024-04-19",
        "official_catalog_title": "Blum's Telegram Mini App is Out",
        "original_canonical_url": "https://blum.io/post/blums-telegram-mini-app-is-out"
      },
      {
        "archive_snapshot_at": "2026-03-15T20:53:58Z",
        "official_catalog_category": "New Features",
        "official_catalog_publication_date": "2024-04-26",
        "official_catalog_title": "What Is Blum? - Learn About the Blum Crypto Ecosystem & FAQ",
        "original_canonical_url": "https://blum.io/post/blums-faq"
      },
      {
        "archive_snapshot_at": "2026-05-13T18:41:44Z",
        "official_catalog_category": "Company News",
        "official_catalog_publication_date": "2024-05-01",
        "official_catalog_title": "Blum is on the Hunt for Developers",
        "original_canonical_url": "https://blum.io/post/blum-is-on-the-hunt-for-a-developers"
      },
      {
        "archive_snapshot_at": "2026-02-14T06:45:12Z",
        "official_catalog_category": "Company News",
        "official_catalog_publication_date": "2024-05-03",
        "official_catalog_title": "Blum's Exciting Roadmap in 2024: What's Coming Up",
        "original_canonical_url": "https://blum.io/post/blums-exciting-roadmap-whats-coming-up"
      },
      {
        "archive_snapshot_at": "2025-11-15T18:19:32Z",
        "official_catalog_category": "New Features",
        "official_catalog_publication_date": "2024-05-18",
        "official_catalog_title": "New on Blum: Drop Game!",
        "original_canonical_url": "https://blum.io/post/new-on-blum-drop-game"
      },
      {
        "archive_snapshot_at": "2026-05-13T19:55:34Z",
        "official_catalog_category": "Campaigns",
        "official_catalog_publication_date": "2024-06-11",
        "official_catalog_title": "Blum Quests Launch Campaign: $10,000 USDT GIVEAWAY!",
        "original_canonical_url": "https://blum.io/post/blum-quests-launch-campaign"
      },
      {
        "archive_snapshot_at": "2026-06-06T19:46:24Z",
        "official_catalog_category": "Company News",
        "official_catalog_publication_date": "2024-07-05",
        "official_catalog_title": "Pokras Lampas Hacked Blum? The Real Story!",
        "original_canonical_url": "https://blum.io/post/pokras-lampas-hacked-blum-the-real-story"
      },
      {
        "archive_snapshot_at": "2026-04-20T10:47:55Z",
        "official_catalog_category": "New Features",
        "official_catalog_publication_date": "2024-07-22",
        "official_catalog_title": "Meet Tribes: Level Up Your Engagement and Rewards on Blum",
        "original_canonical_url": "https://blum.io/post/meet-tribes-level-up-your-engagement-and-rewards-on-blum"
      }
    ],
    "window_end": "2024-08-18",
    "window_start": "2024-03-19"
  },
  "controlled_validation": {
    "failed_count": 0,
    "passed_count": 10,
    "raw_capture_mode": "wayback-id-raw-capture",
    "rerun_same_catalog_hash": true,
    "rerun_stable_content_hash_count": 10,
    "rerun_stable_final_snapshot_url_count": 10,
    "rerun_stable_raw_hash_count": 10,
    "selected_count": 10,
    "status": "passed"
  },
  "frozen_m2_baseline_commit": "3858dbf4236a8b148997dede40b609f057d3b23e",
  "frozen_m2_compatibility": {
    "combined_source_count": 77,
    "current_live_blocker_counts": {
      "date_only_publication_vs_precise_datetime": 3,
      "missing_confirmed_effective_from": 3
    },
    "current_live_source_count": 3,
    "genuine_retrieval_issue_evaluated": false,
    "historical_archive_source_count": 74,
    "historical_blocker_counts": {
      "date_only_publication_vs_precise_datetime": 74,
      "missing_confirmed_effective_from": 74
    },
    "honestly_importable_count": 0,
    "metadata_blocked_count": 77
  },
  "generated_at": "2026-09-10T19:01:39.543626Z",
  "help_center": {
    "acquired_page_count": 0,
    "candidate_page_count": 72,
    "observed_error": "Cloudflare Error 1000: DNS points to prohibited IP",
    "retry_policy": "paused",
    "status": "unavailable_site_side_access_failure"
  },
  "manifest_schema_version": "1.0.0",
  "provenance_contract": {
    "chain": [
      "current_official_blog_index_article_card",
      "official_index_linked_wayback_raw_capture",
      "original_blum_post_url"
    ],
    "content_origin": "historical_archive_snapshot",
    "official_identity_basis": "current_official_blog_index_link",
    "unverified_search_discovered_archive_imported_count": 0
  },
  "source_hash_ledger": [
    {
      "artifact_id": "c9c0c2c2e8daf04884f39692",
      "content_hash": "c724fe75d76ad56fdbc5f6c5f2e363fe082b07f1cb886286e2513dd45f461949",
      "raw_snapshot_hash": "8cc58209e554ef6adcfa24de949ff6bfbf4639dee3c1e22d49d3a45f4131b4d3"
    },
    {
      "artifact_id": "9c5c68959aaa07d299042481",
      "content_hash": "8ca017c2c4892c0f7f8927e0f41d45b66ead0a0da28fa4cb9b1ed4d55eb80643",
      "raw_snapshot_hash": "59f9575f7850e413f0e359f1a6b587a43a61fd8903b0a8847e1e59a17cbef9b0"
    },
    {
      "artifact_id": "6476ef450244ef717c37b9b2",
      "content_hash": "d182710c31a973fcd903bb622dd7da06b22c12b71b2ceaaae54373cd8632c2c0",
      "raw_snapshot_hash": "7bd11b45970df3828fc5683edd0c796c16534914363185145ad2bfa7cf23e3ed"
    },
    {
      "artifact_id": "0b9607f9035bca08f3761f88",
      "content_hash": "14c59d0e92d581d876ea76bab97762725b66415e28913074a42efb9b7afc3d48",
      "raw_snapshot_hash": "f9f8ecef623891199401c360ec9f111ad718243a39ffd8fa93300cce416e64c3"
    },
    {
      "artifact_id": "2e34a450ba9264c0c6ed8c32",
      "content_hash": "31235861276ef73527a31a271aa2928076bee6fd94e3daf98fa4808437c1f64b",
      "raw_snapshot_hash": "e4c93b329195d859fcd50c3a938371014316fdb73253bf237604db28ad7c6588"
    },
    {
      "artifact_id": "b67424163b494ac110b2b0dc",
      "content_hash": "b2febc4e90a0ba95114bfa0a24d0e7b61062396063145536943a8566a348e593",
      "raw_snapshot_hash": "499c51c8ee3ba15f45bf08dbade41dbbd202652e71c88e4cedb1747bc1eaf166"
    },
    {
      "artifact_id": "acf3a33887fee92987589809",
      "content_hash": "156ae1f72fd0b766cd7a4bbcacfe15718f0658822d84a5ef2ad9b5f387611bc6",
      "raw_snapshot_hash": "213fd59056d6770d0e3909db30397fa24239b4ec128261d6736482c1de779443"
    },
    {
      "artifact_id": "3e1e6316e60336cefcd60581",
      "content_hash": "366d8dbbc5cbfd51211a9990dc765d28990831fa5ee5f6719972030cb98a89fb",
      "raw_snapshot_hash": "9e652cd6197e409f25335589c68ee3a9577dc29461b23fefd3e94c9e8516a1d0"
    },
    {
      "artifact_id": "9088036f5a2ad1232520e281",
      "content_hash": "4bbb301a5f4514f2e31f45f1f0cd7f8f169eade1b57d3d54f15e212a1ec4615e",
      "raw_snapshot_hash": "4b1b6f783d580f3e7d935a0f13eb693db88868cf714db48a417a09322b9be63a"
    },
    {
      "artifact_id": "c5f71e97494dfa15f3759256",
      "content_hash": "6e57ef935da6c306838cf8be113a7f09ca72af02d154f819095bcc4425552d7c",
      "raw_snapshot_hash": "3ddbee512c53ea3dc7160668b6ca3e746b3457ab61510f8076fac6c7338c56e0"
    },
    {
      "artifact_id": "ee7a3ca9331d9689ca3cd28f",
      "content_hash": "9fb7fa0b634def9089cc6ba745af98b69d11e1b9aeba3da71bb7a48ef0f470a7",
      "raw_snapshot_hash": "a19b93190871c52528a46376b082dc2e8464f31e5fa84ec3dcd7e99e41542829"
    },
    {
      "artifact_id": "5e376b7c4ed4929959adbc3f",
      "content_hash": "620571c8ac013023d33c37940771be436ca83baa3b81ddaff3da45e67d523d1b",